{"$schema":"http://json-schema.org/draft-07/schema#","additionalProperties":false,"description":"外部评审者对一段样本的盲标输出：一文件一段，只用决策点之前的数据","properties":{"confidence_note":{"type":"string"},"context":{"enum":["上升","下降","震荡","不明"],"type":"string"},"entry":{"type":["number","null"]},"key_evidence":{"items":{"type":"string"},"type":"array"},"no_trade_reason":{"enum":[null,"无命中","位置不对","成色不合格","背景不明","感知未定"],"type":["string","null"]},"primary_hypothesis":{"type":"string"},"qualified":{"type":["boolean","null"]},"segment":{"type":"string"},"setup":{"enum":[null,"B1","B2","B3","A1","A2","C1"],"type":["string","null"]},"side":{"enum":[null,"long","short"],"type":["string","null"]},"stop":{"type":["number","null"]},"targets":{"items":{"type":"number"},"type":"array"},"verdict":{"enum":["candidate","no_trade"],"type":"string"}},"required":["segment","context","primary_hypothesis","verdict","key_evidence"],"title":"PAAnnotation","type":"object"}