{
 "segment": "bn-FILUSDT-15m-1747162800000",
 "context": "震荡",
 "verdict": "no_trade",
 "setup": null,
 "side": null,
 "qualified": null,
 "entry": null,
 "stop": null,
 "targets": [],
 "no_trade_reason": "位置不对",
 "primary_hypothesis": "主假设：2.881–2.983 区间内往返、价格回到上沿无优势；备选：3.0 起的被套多头缺口压制反弹；接管条件：收盘站上 2.983 或跌破 2.881 才定方向。",
 "key_evidence": [
  "trend=震荡/0/边界，ema=2.9414、slope3=+0.0077，价格 2.974 在 EMA 上方 1.1%",
  "openGaps 八条 3.0–3.277 全为 long 被套（depth 0.119–0.396），上方供给密集",
  "147L 2.905 → 166H 2.983 → 174L 2.881 → 177–179 三根阳线（177 实体 100%）反弹至 2.979",
  "179 实体 33%、clv=0.72，价格已贴 166H 2.983 与前高，上方 3.0 缺口即刻压制"
 ],
 "confidence_note": "区间上沿、反弹三根已到前高，追多无空间，空仓。"
}