{
 "segment": "ds13",
 "context": "震荡",
 "verdict": "no_trade",
 "setup": null,
 "side": null,
 "qualified": null,
 "entry": null,
 "stop": null,
 "targets": [],
 "no_trade_reason": "位置不对",
 "primary_hypothesis": "主假设：63740–66956 大区间内的次级往返，价格回到中位无优势；备选：161L 63810 起的抬高低点若破 64475 则短线转多；接管条件：收盘站上 64802（被套多头缺口）或跌破 63810 才易主。",
 "key_evidence": [
  "trend=震荡/0/边界，ema=64331、slope3=+58.9，价格 64528 仅高于 EMA 0.3%",
  "openGaps 三条（65134/64802 long、64350 short）方向冲突、depth 均 <2%",
  "161L 63810 → 171H 64475 → 179 收 64528，仍在 63810–64475 的次级区间上沿附近",
  "177/179 虽为 84%/66% 实体阳线，但未突破 64802 的缺口压制，B1 的「大实体收在位外」不成立"
 ],
 "confidence_note": "区间上沿但未破位，追多无目标、做空无信号，空仓。"
}